{
  "$schema": "https://json-schema.org/draft/2020-12/schema",
  "title": "Envelope de mensagem do PytStop",
  "description": "Corpo JSON de todo comando e evento publicado no RabbitMQ. O campo dados segue o schema <tipo>.schema.json.",
  "type": "object",
  "required": [
    "id",
    "tipo",
    "versao",
    "origem",
    "correlation_id",
    "causation_id",
    "ocorrido_em",
    "dados"
  ],
  "properties": {
    "id": {
      "type": "string",
      "format": "uuid",
      "description": "Id único da mensagem. Vai também na propriedade AMQP message_id e é a chave de idempotência do consumidor."
    },
    "tipo": {
      "type": "string",
      "maxLength": 64,
      "pattern": "^[A-Z][A-Za-z]+(?![\\s\\S])",
      "description": "Nome da mensagem no catálogo (ex.: GerarOrcamento). Vai também na propriedade AMQP type."
    },
    "versao": {
      "type": "integer",
      "minimum": 1,
      "description": "Versão do schema de dados; mudança incompatível cria versão nova."
    },
    "origem": {
      "enum": [
        "os-service",
        "billing-service",
        "execution-service"
      ],
      "description": "Serviço que publicou a mensagem."
    },
    "correlation_id": {
      "type": "string",
      "format": "uuid",
      "description": "Id da ordem de serviço, que também identifica a instância da saga; em mensagem fora da saga, o id do agregado tratado (AnonimizarVeiculo: veiculo_id). Vai também na propriedade AMQP correlation_id."
    },
    "causation_id": {
      "type": [
        "string",
        "null"
      ],
      "format": "uuid",
      "description": "Id da mensagem que causou esta. Resposta a comando, inclusive o desfecho republicado para comando repetido: o id do comando respondido. Evento espontâneo (decisão do cliente, webhook ou conciliação, prazo do Billing, ação do mecânico): o id do comando que abriu o fluxo, como o do GerarOrcamento em OrcamentoAprovado. Comando do orquestrador: o id do evento que o disparou, ou null quando a causa é uma requisição HTTP (abertura, cancelamento, retomada, eliminação de dados) ou o prazo técnico (reenvio ou esgotamento). Evento nunca leva null: o orquestrador reconhece por este campo a resposta ao comando em voo."
    },
    "ocorrido_em": {
      "type": "string",
      "format": "date-time",
      "pattern": "(Z|\\+00:00)(?![\\s\\S])",
      "description": "Instante do fato em UTC (RFC 3339 com Z ou +00:00)."
    },
    "dados": {
      "type": "object",
      "description": "Conteúdo específico do tipo."
    }
  }
}
