{
  "id": "1f8456ca-1902-412b-99f0-d45c359e862b",
  "tipo": "OrcamentoCancelado",
  "versao": 1,
  "origem": "billing-service",
  "correlation_id": "495db021-ac8d-4a7e-94d1-734c7eab475c",
  "causation_id": "a7a790a1-3e90-49c6-afed-972fa14765c2",
  "ocorrido_em": "2026-10-06T14:15:00Z",
  "dados": {
    "ordem_id": "495db021-ac8d-4a7e-94d1-734c7eab475c",
    "orcamento_id": "8605886c-3bb2-4165-8f1d-2368c87022e9"
  }
}
