{
  "id": "28b12fe4-3a5a-44d3-bc02-a008631da140",
  "tipo": "OrcamentoAprovado",
  "versao": 1,
  "origem": "billing-service",
  "correlation_id": "495db021-ac8d-4a7e-94d1-734c7eab475c",
  "causation_id": "aab90131-077c-473b-8f58-84287532cb38",
  "ocorrido_em": "2026-10-06T13:30:00Z",
  "dados": {
    "ordem_id": "495db021-ac8d-4a7e-94d1-734c7eab475c",
    "orcamento_id": "8605886c-3bb2-4165-8f1d-2368c87022e9",
    "decidido_em": "2026-10-06T13:30:00Z",
    "canal": "link"
  }
}
