{
  "id": "09da7a1c-3a14-483c-9b5b-c484ebefb77a",
  "tipo": "OrcamentoRecusado",
  "versao": 1,
  "origem": "billing-service",
  "correlation_id": "495db021-ac8d-4a7e-94d1-734c7eab475c",
  "causation_id": null,
  "ocorrido_em": "2026-10-06T13:30:00Z",
  "dados": {
    "ordem_id": "495db021-ac8d-4a7e-94d1-734c7eab475c",
    "orcamento_id": "8605886c-3bb2-4165-8f1d-2368c87022e9",
    "decidido_em": "2026-10-06T13:30:00Z",
    "canal": "atendente",
    "decidido_por": "2f4e8c1a-7b3d-4e5f-9a6b-1c2d3e4f5a6b"
  }
}
