{
  "id": "e427adf9-8a10-4257-9a79-65d824258555",
  "tipo": "EstornoDePagamentoFalhou",
  "versao": 1,
  "origem": "billing-service",
  "correlation_id": "495db021-ac8d-4a7e-94d1-734c7eab475c",
  "causation_id": "7e75d816-1b35-4a02-871f-a5fe089eddb7",
  "ocorrido_em": "2026-10-06T14:13:00Z",
  "dados": {
    "ordem_id": "495db021-ac8d-4a7e-94d1-734c7eab475c",
    "pagamento_id": "8b7fdbea-b573-47c6-8654-df9ea01818c8",
    "motivo": "Provedor de pagamento recusou a operacao"
  }
}
