{
  "id": "0bb4a81f-e4c5-4503-8db1-e6702775fb67",
  "tipo": "PagamentoRecusado",
  "versao": 1,
  "origem": "billing-service",
  "correlation_id": "495db021-ac8d-4a7e-94d1-734c7eab475c",
  "causation_id": "947bc2d1-54b0-4972-900a-bc62b2e45922",
  "ocorrido_em": "2026-10-06T13:50:00Z",
  "dados": {
    "ordem_id": "495db021-ac8d-4a7e-94d1-734c7eab475c",
    "pagamento_id": "8b7fdbea-b573-47c6-8654-df9ea01818c8",
    "motivo": "Pagamento recusado pelo emissor do cartão."
  }
}
